{
  "$schema": "https://json-schema.org/draft/2020-12/schema",
  "$id": "klode-kit/check_receipt.json",
  "title": "Check receipt (builds/<build_id>/check_receipt.json)",
  "description": "/kb-check result for one build directory (02 r3.2, R2-07, R2-11, r4.2). u5_ready is true only when the host sees the MCP server connected and the direct probe read a build_id.",
  "type": "object",
  "additionalProperties": false,
  "required": [
    "schema",
    "build_id",
    "kb_id",
    "status",
    "checks",
    "mcp",
    "u5_ready"
  ],
  "properties": {
    "schema": {
      "const": "klode-kit.check_receipt/1"
    },
    "build_id": {
      "type": "string",
      "pattern": "^b-[0-9]{8}T[0-9]{6}Z-[0-9a-f]{8}$"
    },
    "kb_id": {
      "type": "string",
      "minLength": 1
    },
    "status": {
      "enum": [
        "PASS",
        "WARN",
        "FAIL"
      ]
    },
    "at": {
      "type": "string",
      "pattern": "^\\d{4}-\\d{2}-\\d{2}T\\d{2}:\\d{2}:\\d{2}(\\.\\d+)?(Z|[+-]\\d{2}:\\d{2})$"
    },
    "checks": {
      "type": "array",
      "minItems": 1,
      "items": {
        "type": "object",
        "additionalProperties": false,
        "required": [
          "name",
          "status"
        ],
        "properties": {
          "name": {
            "type": "string",
            "minLength": 1
          },
          "status": {
            "enum": [
              "PASS",
              "WARN",
              "FAIL"
            ]
          },
          "detail": {
            "type": "string"
          }
        }
      }
    },
    "mcp": {
      "type": "object",
      "additionalProperties": false,
      "required": [
        "mcp_config_written",
        "mcp_direct_smoke",
        "mcp_host_visible"
      ],
      "properties": {
        "mcp_config_written": {
          "type": "boolean"
        },
        "mcp_direct_smoke": {
          "type": "boolean"
        },
        "mcp_host_visible": {
          "enum": [
            "connected",
            "pending",
            "failed",
            "not_run"
          ]
        }
      }
    },
    "probe": {
      "type": "object",
      "additionalProperties": false,
      "required": [
        "build_id"
      ],
      "properties": {
        "build_id": {
          "type": "string",
          "pattern": "^b-[0-9]{8}T[0-9]{6}Z-[0-9a-f]{8}$"
        }
      }
    },
    "u5_ready": {
      "type": "boolean"
    },
    "plugin": {
      "type": "object",
      "additionalProperties": false,
      "required": [
        "name",
        "version",
        "entry",
        "root_sha"
      ],
      "properties": {
        "name": {
          "type": "string",
          "minLength": 1
        },
        "version": {
          "type": "string",
          "minLength": 1
        },
        "entry": {
          "type": "string",
          "minLength": 1
        },
        "root_sha": {
          "type": "string",
          "pattern": "^[0-9a-f]{64}$"
        }
      }
    }
  },
  "allOf": [
    {
      "if": {
        "required": [
          "u5_ready"
        ],
        "properties": {
          "u5_ready": {
            "const": true
          }
        }
      },
      "then": {
        "required": [
          "probe"
        ],
        "properties": {
          "mcp": {
            "properties": {
              "mcp_host_visible": {
                "const": "connected"
              }
            }
          }
        }
      }
    }
  ]
}
